Country,Address ID,Gender,Name,Email,Position,Company,Work Phone,Personal Phone
algeria,1,m,Aicha Barki,aiqraa.asso@caramail.com,Presidente,Association Algerienne d'Alphabetisation Iqraa,+ (213) 6150 4015,+ (213) 2173 5247
angola,2,m,Francisco Domingos,frandomingos@hotmail.com,Directeur General,Institut National de Education des Adultes,+ (244-2) 325 023,+ (244-2) 325 023
angola,3,f,Maria Luisa,luisagrilo@ebonet.net,Directrice Nationale,Institut National de Education des Adultes,,+ (244) 4232 2836
angola,4,m,Abraao Chanda,ineda@snet.co.ao,Chef,Institut National de Education des Adultes,+ (244-2) 325 023,+ (244-2) 325 023
argentina,5,m,Beatriz Busaniche,busaniche@caminandoutopias.org.ar,Executive Director,Universidad de Buenos Aires,+ (54-11) 4784 1159,
australia,6,f,Francesca Beddie,f.beddie@ala.asn.au,Executive Director,Adult Learning Australia,+ (61-2) 6274 9500,+ (61-2) 6274 9513
australia,7,m,Graham John Smith,grasm@connexus.net.au,Secretary,Disability Australia Ltd,+ (61-3) 9807 4702,
